### ISSUE TITLE
pod in a UDN cannot access a nodePort service in a same UDN network with externalTrafficPolicy=Local on different node

### ISSUE THREAD

**Issue by zhaozhanqi** [ovn-kubernetes/ovn-kubernetes#5531]
### What happened?

1. apply cudn l3 and nodeport service with ETP=Local.

kubectl get svc -n udn-ns3 
NAME           TYPE       CLUSTER-IP       EXTERNAL-IP   PORT(S)           AGE
test-service   NodePort   172.30.149.254   <none>        27017:32226/TCP   26h

2.  there is backend pod on node1
3. Now from pod on node2 cannot access the nodeport service
$ curl 192.168.111.23:32226
curl: (56) Recv failure: Connection reset by peer

### What did you expect to happen?

pod in a UDN should be able to access a nodePort service in a different UDN network with externalTrafficPolicy=Local on different node

### How can we reproduce it (as minimally and precisely as possible)?

1. Setup cluster with LGW mode
2. Create UDN namespace and nodePort service with etp=local and backend pod
3. Create another client pod in same UDN namespace on different node
4.  from the client pod to access the nodePort service.

### OVN-Kubernetes version

<details>

```console
# kubectl exec -n ovn-kubernetes ovnkube-node-kfj6f -- ovnkube --version
Defaulted container "nb-ovsdb" out of: nb-ovsdb, sb-ovsdb, ovn-northd, ovnkube-controller, ovn-controller, ovs-metrics-exporter
Version: 1.1.0
Git commit: 814977fdc13ed470b1ddf04d1e29da28d8679ab9
Go version: go1.24.5
Build date: 2025-08-19
OS/Arch: linux amd64

```

</details>

### Kubernetes version

<details>

```console
# kubectl version
Client Version: v1.32.3
Kustomize Version: v5.5.0
Server Version: v1.33.1

```

</details>

### OVN version

<details>

```console
kubectl exec -n ovn-kubernetes ovnkube-node-kfj6f -- rpm -q ovn
Defaulted container "nb-ovsdb" out of: nb-ovsdb, sb-ovsdb, ovn-northd, ovnkube-controller, ovn-controller, ovs-metrics-exporter
ovn-25.03.1-42.fc42.x86_64

```

</details>

### OVS version

<details>

```console
# kubectl exec -n ovn-kubernetes ovnkube-node-kfj6f -- rpm -q openvswitch
Defaulted container "nb-ovsdb" out of: nb-ovsdb, sb-ovsdb, ovn-northd, ovnkube-controller, ovn-controller, ovs-metrics-exporter
openvswitch-3.4.1-1.fc42.x86_64

```

</details>

### Platform

<details>

baremetal
</details>

### OS version

<details>

```console
# On Linux:
$ cat /etc/os-release
# paste output here
$ uname -a
# paste output here

# On Windows:
C:\> wmic os get Caption, Version, BuildNumber, OSArchitecture
# paste output here
```

</details>

### Install tools

<details>

</details>

### Container runtime (CRI) and version (if applicable)

<details>

</details>

**Comment by tssurya** [comment]
@zhaozhanqi - do you know if the behaviour is same w/ and w/o BGP? that this test would fail with 56 also for pure cross UDN ETP=local?

**Comment by zhaozhanqi** [comment]
@tssurya yes, according to our testing before.  it should be same w/ or w/o BGP

**Comment by tssurya** [comment]
let's use this tracker for tracking all the abnomalities:
https://github.com/ovn-kubernetes/ovn-kubernetes/pull/5387/changes/f1b28fc139c3289b2775e07901feb5b5b931583a


```
+------------------+-------------+------------------+------------------+
| LGW + ETP=Local  | IP Stack    | IPv4 Error Code  | IPv6 Error Code  |
+------------------+-------------+------------------+------------------+
| Layer3           | Dual-stack  |       56         |       28         |
| Layer3           | IPv6-only   |       N/A        |       56         |
+------------------+-------------+------------------+------------------+
| Layer2           | Dual-stack  |       56         |       28         |
| Layer2           | IPv6-only   |       N/A        |       56         |
+------------------+-------------+------------------+------------------+

Error Codes:
  - 56 = CURLE_RECV_ERROR (connection reset by peer)
  - 28 = CURLE_OPERATION_TIMEDOUT (timeout)
```

Summary:
```
+---------------------+------------------------------------------------------------------+
| Scenario            | Result                                                           |
+---------------------+------------------------------------------------------------------+
| IPv4 (any stack)    | 56 (RST) - OVN bug fixed, OVN-K needs `ct-commit-all` on LR      |
+---------------------+------------------------------------------------------------------+
| IPv6 (dual-stack)   | 28 (timeout) - different failure mode, OVN-K fwmark bug          |
+---------------------+------------------------------------------------------------------+
| IPv6 (single-stack) | 56 (RST) - same as IPv4                                          |
+---------------------+------------------------------------------------------------------+

Root Cause for curl 56:
  - OVN's ct_lb_mark doesn't do NAT restoration for established packets
  - Masquerade SNAT (zone=24) applies before LB un-DNAT (zone=29)
  - Backend replies get SNAT'd to 169.254.0.36 instead of un-DNAT'd to 169.254.0.3
  - nftables can't un-DNAT the wrong address → RST

Root Cause for curl 28: (https://github.com/ovn-kubernetes/ovn-kubernetes/issues/5846)

Related Issues:
  - OVN Bug:        https://issues.redhat.com/browse/FDP-787
  - OVN-K Fix:      https://issues.redhat.com/browse/OCPBUGS-50912
                    (Need to use `ct-commit-all` flag on Logical Router)
  - GitHub Issue:   https://github.com/ovn-kubernetes/ovn-kubernetes/issues/5531
  - GitHub Comment: https://github.com/ovn-kubernetes/ovn-kubernetes/issues/5531
                    #issuecomment-3749437522
```

**Comment by tssurya** [comment]
Debugging Session for Layer3 advertised CUDN (but I think same issue might exist with normal CUDNs/UDNs as well) - single stack v4, single stack v6 and dualstack first family - all give out 56 error code. My cluster was IPV4 singlestack but I believe the RCA is the same for all the 3 cases (single stack v4, single stack v6 and dualstack first family) I listed.

Traffic Flow: UDN-networkA pod (102.102.2.5) on ovn-control-plane node (172.18.0.3) tries to reach nodeport service in network-A (31881/TCP) on ovn-worker's nodeIP (172.18.0.4). The backend pod also exists on ovn-worker node (102.102.2.4)

K8s objects:
```
$ k get ns
NAME                         STATUS   AGE
bgp-network-isolation-5505   Active   96m
bgp-network-isolation-9706   Active   96m

===
$ k get svc -A
NAMESPACE                    NAME                                          TYPE        CLUSTER-IP      EXTERNAL-IP   PORT(S)                  AGE
bgp-network-isolation-5505   service-bgp-udn-layer3-network-b              NodePort    10.96.39.217    <none>        8080:30293/TCP           100m
bgp-network-isolation-9706   nodeport-etp-local-bgp-udn-layer3-network-a   NodePort    10.96.133.114   <none>        8080:31881/TCP           100m
bgp-network-isolation-9706   service-bgp-udn-layer3-network-a              NodePort    10.96.181.131   <none>        8080:31604/TCP           100m

===
$ k get endpointslices -n bgp-network-isolation-9706
NAME                                                ADDRESSTYPE   PORTS   ENDPOINTS                             AGE
nodeport-etp-local-bgp-udn-layer3-network-a-64s8h   IPv4          8080    10.244.2.3,10.244.2.4,10.244.1.4      101m
nodeport-etp-local-bgp-udn-layer3-network-a-mv98z   IPv4          8080    102.102.2.5,102.102.2.8,102.102.0.4   101m
service-bgp-udn-layer3-network-a-94jpk              IPv4          8080    10.244.1.4,10.244.2.3,10.244.2.4      101m
service-bgp-udn-layer3-network-a-vhw7v              IPv4          8080    102.102.0.4,102.102.2.5,102.102.2.8   101m

===
$ k get pods -n bgp-network-isolation-9706 -owide
NAME                                                   READY   STATUS    RESTARTS   AGE     IP           NODE                NOMINATED NODE   READINESS GATES
pod-1-ovn-control-plane-net-bgp-udn-layer3-network-a   1/1     Running   0          4h18m   10.244.2.3   ovn-control-plane   <none>           <none> ----> source pod
pod-2-ovn-control-plane-net-bgp-udn-layer3-network-a   1/1     Running   0          4h18m   10.244.2.4   ovn-control-plane   <none>           <none>
pod-3-ovn-worker-net-bgp-udn-layer3-network-a          1/1     Running   0          4h18m   10.244.1.4   ovn-worker          <none>           <none> ----> backend pod destination for nodeport service for ETP=local

```

Curl and TCP Dump captured on ovn-control-plane and ovn-worker: (note ping works, curl fails)

```
$ oc rsh -n bgp-network-isolation-9706 pod-1-ovn-control-plane-net-bgp-udn-layer3-network-a
/ # curl -g -q  --max-time 2 --insecure 172.18.0.4:31881/hostname
curl: (56) Recv failure: Connection reset by peer

TCPDUMP from ovn-control-plane:

root@ovn-control-plane:/# tcpdump -i any -nnee  port 36363 or host 169.254.0.36 or port 31881
tcpdump: data link type LINUX_SLL2
tcpdump: verbose output suppressed, use -v[v]... for full protocol decode
listening on any, link-type LINUX_SLL2 (Linux cooked v2), snapshot length 262144 bytes
12:55:20.791682 c03868360fe24_3 P   ifindex 62 0a:58:66:66:02:05 ethertype IPv4 (0x0800), length 80: 102.102.2.5.36363 > 172.18.0.4.31881: Flags [S], seq 399490694, win 65280, options [mss 1360,sackOK,TS val 1732271276 ecr 0,nop,wscale 7], length 0
12:55:20.793256 ovn-k8s-mp13 In  ifindex 57 0a:58:66:66:02:01 ethertype IPv4 (0x0800), length 80: 169.254.0.36.47870 > 172.18.0.4.31881: Flags [S], seq 399490694, win 65280, options [mss 1360,sackOK,TS val 1732271276 ecr 0,nop,wscale 7], length 0
12:55:20.793420 breth0 Out ifindex 6 fe:43:55:de:2b:db ethertype IPv4 (0x0800), length 80: 172.18.0.3.47870 > 172.18.0.4.31881: Flags [S], seq 399490694, win 65280, options [mss 1360,sackOK,TS val 1732271276 ecr 0,nop,wscale 7], length 0
12:55:20.793483 eth0  Out ifindex 2 fe:43:55:de:2b:db ethertype IPv4 (0x0800), length 80: 172.18.0.3.47870 > 172.18.0.4.31881: Flags [S], seq 399490694, win 65280, options [mss 1360,sackOK,TS val 1732271276 ecr 0,nop,wscale 7], length 0
12:55:20.798249 eth0  In  ifindex 2 82:5f:93:13:a3:eb ethertype IPv4 (0x0800), length 80: 172.18.0.4.31881 > 172.18.0.3.47870: Flags [S.], seq 1742714133, ack 399490695, win 64704, options [mss 1360,sackOK,TS val 2410724979 ecr 1732271276,nop,wscale 7], length 0
12:55:20.798327 breth0 In  ifindex 6 82:5f:93:13:a3:eb ethertype IPv4 (0x0800), length 80: 172.18.0.4.31881 > 172.18.0.3.47870: Flags [S.], seq 1742714133, ack 399490695, win 64704, options [mss 1360,sackOK,TS val 2410724979 ecr 1732271276,nop,wscale 7], length 0
12:55:20.798494 ovn-k8s-mp13 Out ifindex 57 0a:58:66:66:02:02 ethertype IPv4 (0x0800), length 80: 172.18.0.4.31881 > 169.254.0.36.47870: Flags [S.], seq 1742714133, ack 399490695, win 64704, options [mss 1360,sackOK,TS val 2410724979 ecr 1732271276,nop,wscale 7], length 0
12:55:20.799990 c03868360fe24_3 Out ifindex 62 0a:58:66:66:02:01 ethertype IPv4 (0x0800), length 80: 172.18.0.4.31881 > 102.102.2.5.36363: Flags [S.], seq 1742714133, ack 399490695, win 64704, options [mss 1360,sackOK,TS val 2410724979 ecr 1732271276,nop,wscale 7], length 0
12:55:20.800213 c03868360fe24_3 P   ifindex 62 0a:58:66:66:02:05 ethertype IPv4 (0x0800), length 72: 102.102.2.5.36363 > 172.18.0.4.31881: Flags [.], ack 1, win 510, options [nop,nop,TS val 1732271285 ecr 2410724979], length 0
12:55:20.800370 c03868360fe24_3 P   ifindex 62 0a:58:66:66:02:05 ethertype IPv4 (0x0800), length 160: 102.102.2.5.36363 > 172.18.0.4.31881: Flags [P.], seq 1:89, ack 1, win 510, options [nop,nop,TS val 1732271285 ecr 2410724979], length 88
12:55:20.801339 ovn-k8s-mp13 In  ifindex 57 0a:58:66:66:02:01 ethertype IPv4 (0x0800), length 72: 169.254.0.36.47870 > 172.18.0.4.31881: Flags [.], ack 1, win 510, options [nop,nop,TS val 1732271285 ecr 2410724979], length 0
12:55:20.801475 ovn-k8s-mp13 In  ifindex 57 0a:58:66:66:02:01 ethertype IPv4 (0x0800), length 160: 169.254.0.36.47870 > 172.18.0.4.31881: Flags [P.], seq 1:89, ack 1, win 510, options [nop,nop,TS val 1732271285 ecr 2410724979], length 88
12:55:20.801544 breth0 Out ifindex 6 fe:43:55:de:2b:db ethertype IPv4 (0x0800), length 72: 172.18.0.3.47870 > 172.18.0.4.31881: Flags [.], ack 1, win 510, options [nop,nop,TS val 1732271285 ecr 2410724979], length 0
12:55:20.801597 eth0  Out ifindex 2 fe:43:55:de:2b:db ethertype IPv4 (0x0800), length 72: 172.18.0.3.47870 > 172.18.0.4.31881: Flags [.], ack 1, win 510, options [nop,nop,TS val 1732271285 ecr 2410724979], length 0
12:55:20.801649 breth0 Out ifindex 6 fe:43:55:de:2b:db ethertype IPv4 (0x0800), length 160: 172.18.0.3.47870 > 172.18.0.4.31881: Flags [P.], seq 1:89, ack 1, win 510, options [nop,nop,TS val 1732271285 ecr 2410724979], length 88
12:55:20.801701 eth0  Out ifindex 2 fe:43:55:de:2b:db ethertype IPv4 (0x0800), length 160: 172.18.0.3.47870 > 172.18.0.4.31881: Flags [P.], seq 1:89, ack 1, win 510, options [nop,nop,TS val 1732271285 ecr 2410724979], length 88
12:55:21.014732 c03868360fe24_3 P   ifindex 62 0a:58:66:66:02:05 ethertype IPv4 (0x0800), length 160: 102.102.2.5.36363 > 172.18.0.4.31881: Flags [P.], seq 1:89, ack 1, win 510, options [nop,nop,TS val 1732271500 ecr 2410724979], length 88
12:55:21.014800 ovn-k8s-mp13 In  ifindex 57 0a:58:66:66:02:01 ethertype IPv4 (0x0800), length 160: 169.254.0.36.47870 > 172.18.0.4.31881: Flags [P.], seq 1:89, ack 1, win 510, options [nop,nop,TS val 1732271500 ecr 2410724979], length 88
12:55:21.014887 breth0 Out ifindex 6 fe:43:55:de:2b:db ethertype IPv4 (0x0800), length 160: 172.18.0.3.47870 > 172.18.0.4.31881: Flags [P.], seq 1:89, ack 1, win 510, options [nop,nop,TS val 1732271500 ecr 2410724979], length 88
12:55:21.014910 eth0  Out ifindex 2 fe:43:55:de:2b:db ethertype IPv4 (0x0800), length 160: 172.18.0.3.47870 > 172.18.0.4.31881: Flags [P.], seq 1:89, ack 1, win 510, options [nop,nop,TS val 1732271500 ecr 2410724979], length 88
12:55:21.015687 eth0  In  ifindex 2 82:5f:93:13:a3:eb ethertype IPv4 (0x0800), length 60: 172.18.0.4.31881 > 172.18.0.3.47870: Flags [R], seq 1742714134, win 0, length 0
12:55:21.015734 breth0 In  ifindex 6 82:5f:93:13:a3:eb ethertype IPv4 (0x0800), length 60: 172.18.0.4.31881 > 172.18.0.3.47870: Flags [R], seq 1742714134, win 0, length 0
12:55:21.015876 ovn-k8s-mp13 Out ifindex 57 0a:58:66:66:02:02 ethertype IPv4 (0x0800), length 60: 172.18.0.4.31881 > 169.254.0.36.47870: Flags [R], seq 1742714134, win 0, length 0
12:55:21.015927 c03868360fe24_3 Out ifindex 62 0a:58:66:66:02:01 ethertype IPv4 (0x0800), length 60: 172.18.0.4.31881 > 102.102.2.5.36363: Flags [R], seq 1742714134, win 0, length 0

TCPDUMP from ovn-worker:

root@ovn-worker:/# tcpdump -i any -nneev port 31881 or host 102.102.0.4 or host 169.254.0.36
tcpdump: data link type LINUX_SLL2
tcpdump: listening on any, link-type LINUX_SLL2 (Linux cooked v2), snapshot length 262144 bytes
12:55:20.793743 eth0  In  ifindex 2 82:5f:93:13:a3:eb ethertype IPv4 (0x0800), length 80: (tos 0x0, ttl 61, id 2687, offset 0, flags [DF], proto TCP (6), length 60)
    172.18.0.3.47870 > 172.18.0.4.31881: Flags [S], cksum 0x1f6d (correct), seq 399490694, win 65280, options [mss 1360,sackOK,TS val 1732271276 ecr 0,nop,wscale 7], length 0
12:55:20.794073 breth0 In  ifindex 6 82:5f:93:13:a3:eb ethertype IPv4 (0x0800), length 80: (tos 0x0, ttl 61, id 2687, offset 0, flags [DF], proto TCP (6), length 60)
    172.18.0.3.47870 > 172.18.0.4.31881: Flags [S], cksum 0x1f6d (correct), seq 399490694, win 65280, options [mss 1360,sackOK,TS val 1732271276 ecr 0,nop,wscale 7], length 0
12:55:20.794249 ovn-k8s-mp13 Out ifindex 64 0a:58:66:66:00:02 ethertype IPv4 (0x0800), length 80: (tos 0x0, ttl 60, id 2687, offset 0, flags [DF], proto TCP (6), length 60)
    172.18.0.3.47870 > 169.254.0.3.31881: Flags [S], cksum 0x2182 (correct), seq 399490694, win 65280, options [mss 1360,sackOK,TS val 1732271276 ecr 0,nop,wscale 7], length 0
12:55:20.796257 6c97d68d563eb_3 Out ifindex 69 0a:58:66:66:00:01 ethertype IPv4 (0x0800), length 80: (tos 0x0, ttl 59, id 2687, offset 0, flags [DF], proto TCP (6), length 60)
    172.18.0.3.47870 > 102.102.0.4.8080: Flags [S], cksum 0xc212 (correct), seq 399490694, win 65280, options [mss 1360,sackOK,TS val 1732271276 ecr 0,nop,wscale 7], length 0
12:55:20.796407 6c97d68d563eb_3 P   ifindex 69 0a:58:66:66:00:04 ethertype IPv4 (0x0800), length 80: (tos 0x0, ttl 64, id 0, offset 0, flags [DF], proto TCP (6), length 60)
    102.102.0.4.8080 > 172.18.0.3.47870: Flags [S.], cksum 0x12ae (incorrect -> 0x5928), seq 1742714133, ack 399490695, win 64704, options [mss 1360,sackOK,TS val 2410724979 ecr 1732271276,nop,wscale 7], length 0
12:55:20.797475 ovn-k8s-mp13 In  ifindex 64 0a:58:66:66:00:01 ethertype IPv4 (0x0800), length 80: (tos 0x0, ttl 63, id 0, offset 0, flags [DF], proto TCP (6), length 60)
    169.254.0.3.31881 > 172.18.0.3.47870: Flags [S.], cksum 0xb897 (correct), seq 1742714133, ack 399490695, win 64704, options [mss 1360,sackOK,TS val 2410724979 ecr 1732271276,nop,wscale 7], length 0
12:55:20.797688 breth0 Out ifindex 6 5e:13:4e:d9:eb:df ethertype IPv4 (0x0800), length 80: (tos 0x0, ttl 62, id 0, offset 0, flags [DF], proto TCP (6), length 60)
    172.18.0.4.31881 > 172.18.0.3.47870: Flags [S.], cksum 0xb682 (correct), seq 1742714133, ack 399490695, win 64704, options [mss 1360,sackOK,TS val 2410724979 ecr 1732271276,nop,wscale 7], length 0
12:55:20.797900 eth0  Out ifindex 2 5e:13:4e:d9:eb:df ethertype IPv4 (0x0800), length 80: (tos 0x0, ttl 62, id 0, offset 0, flags [DF], proto TCP (6), length 60)
    172.18.0.4.31881 > 172.18.0.3.47870: Flags [S.], cksum 0xb682 (correct), seq 1742714133, ack 399490695, win 64704, options [mss 1360,sackOK,TS val 2410724979 ecr 1732271276,nop,wscale 7], length 0
12:55:20.801866 eth0  In  ifindex 2 82:5f:93:13:a3:eb ethertype IPv4 (0x0800), length 160: (tos 0x0, ttl 61, id 2689, offset 0, flags [DF], proto TCP (6), length 140)
    172.18.0.3.47870 > 172.18.0.4.31881: Flags [P.], cksum 0x8bea (correct), seq 1:89, ack 1, win 510, options [nop,nop,TS val 1732271285 ecr 2410724979], length 88
12:55:20.801882 eth0  In  ifindex 2 82:5f:93:13:a3:eb ethertype IPv4 (0x0800), length 72: (tos 0x0, ttl 61, id 2688, offset 0, flags [DF], proto TCP (6), length 52)
    172.18.0.3.47870 > 172.18.0.4.31881: Flags [.], cksum 0xdfa4 (correct), ack 1, win 510, options [nop,nop,TS val 1732271285 ecr 2410724979], length 0
12:55:20.801901 breth0 In  ifindex 6 82:5f:93:13:a3:eb ethertype IPv4 (0x0800), length 160: (tos 0x0, ttl 61, id 2689, offset 0, flags [DF], proto TCP (6), length 140)
    172.18.0.3.47870 > 172.18.0.4.31881: Flags [P.], cksum 0x8bea (correct), seq 1:89, ack 1, win 510, options [nop,nop,TS val 1732271285 ecr 2410724979], length 88
12:55:20.801932 breth0 In  ifindex 6 82:5f:93:13:a3:eb ethertype IPv4 (0x0800), length 72: (tos 0x0, ttl 61, id 2688, offset 0, flags [DF], proto TCP (6), length 52)
    172.18.0.3.47870 > 172.18.0.4.31881: Flags [.], cksum 0xdfa4 (correct), ack 1, win 510, options [nop,nop,TS val 1732271285 ecr 2410724979], length 0
12:55:20.802048 ovn-k8s-mp13 Out ifindex 64 0a:58:66:66:00:02 ethertype IPv4 (0x0800), length 160: (tos 0x0, ttl 60, id 2689, offset 0, flags [DF], proto TCP (6), length 140)
    172.18.0.3.47870 > 169.254.0.3.31881: Flags [P.], cksum 0x8dff (correct), seq 1:89, ack 1, win 510, options [nop,nop,TS val 1732271285 ecr 2410724979], length 88
12:55:20.802082 ovn-k8s-mp13 Out ifindex 64 0a:58:66:66:00:02 ethertype IPv4 (0x0800), length 72: (tos 0x0, ttl 60, id 2688, offset 0, flags [DF], proto TCP (6), length 52)
    172.18.0.3.47870 > 169.254.0.3.31881: Flags [.], cksum 0xe1b9 (correct), ack 1, win 510, options [nop,nop,TS val 1732271285 ecr 2410724979], length 0
12:55:20.802997 6c97d68d563eb_3 Out ifindex 69 0a:58:66:66:00:01 ethertype IPv4 (0x0800), length 72: (tos 0x0, ttl 59, id 2688, offset 0, flags [DF], proto TCP (6), length 52)
    172.18.0.3.47870 > 102.102.0.4.8080: Flags [.], cksum 0x824a (correct), ack 1, win 510, options [nop,nop,TS val 1732271285 ecr 2410724979], length 0
12:55:20.803006 6c97d68d563eb_3 Out ifindex 69 0a:58:66:66:00:01 ethertype IPv4 (0x0800), length 160: (tos 0x0, ttl 59, id 2689, offset 0, flags [DF], proto TCP (6), length 140)
    172.18.0.3.47870 > 102.102.0.4.8080: Flags [P.], cksum 0x2e90 (correct), seq 1:89, ack 1, win 510, options [nop,nop,TS val 1732271285 ecr 2410724979], length 88: HTTP, length: 88
	GET /hostname HTTP/1.1
	Host: 172.18.0.4:31881
	User-Agent: curl/8.12.1
	Accept: */*
	
12:55:20.803070 6c97d68d563eb_3 P   ifindex 69 0a:58:66:66:00:04 ethertype IPv4 (0x0800), length 72: (tos 0x0, ttl 64, id 43201, offset 0, flags [DF], proto TCP (6), length 52)
    102.102.0.4.8080 > 172.18.0.3.47870: Flags [.], cksum 0x12a6 (incorrect -> 0x81f0), ack 89, win 505, options [nop,nop,TS val 2410724986 ecr 1732271285], length 0
12:55:20.803281 ovn-k8s-mp13 In  ifindex 64 0a:58:66:66:00:01 ethertype IPv4 (0x0800), length 72: (tos 0x0, ttl 63, id 43201, offset 0, flags [DF], proto TCP (6), length 52)
    169.254.0.36.33656 > 172.18.0.3.47870: Flags [.], cksum 0xda4f (correct), ack 399490783, win 505, options [nop,nop,TS val 2410724986 ecr 1732271285], length 0
12:55:20.803301 6c97d68d563eb_3 P   ifindex 69 0a:58:66:66:00:04 ethertype IPv4 (0x0800), length 234: (tos 0x0, ttl 64, id 43202, offset 0, flags [DF], proto TCP (6), length 214)
    102.102.0.4.8080 > 172.18.0.3.47870: Flags [P.], cksum 0x1348 (incorrect -> 0xa98e), seq 1:163, ack 89, win 505, options [nop,nop,TS val 2410724986 ecr 1732271285], length 162: HTTP, length: 162
	HTTP/1.1 200 OK
	Date: Wed, 14 Jan 2026 12:55:20 GMT
	Content-Length: 45
	Content-Type: text/plain; charset=utf-8
	
	pod-3-ovn-worker-net-bgp-udn-layer3-network-a [|http]
12:55:20.803330 ovn-k8s-mp13 In  ifindex 64 0a:58:66:66:00:01 ethertype IPv4 (0x0800), length 234: (tos 0x0, ttl 63, id 43202, offset 0, flags [DF], proto TCP (6), length 214)
    169.254.0.36.33656 > 172.18.0.3.47870: Flags [P.], cksum 0x5700 (incorrect -> 0x01ee), seq 0:162, ack 1, win 505, options [nop,nop,TS val 2410724986 ecr 1732271285], length 162
12:55:20.803593 ovn-k8s-mp13 Out ifindex 64 0a:58:66:66:00:02 ethertype IPv4 (0x0800), length 60: (tos 0x0, ttl 63, id 0, offset 0, flags [DF], proto TCP (6), length 40)
    172.18.0.3.47870 > 169.254.0.36.33656: Flags [R], cksum 0x4483 (correct), seq 399490783, win 0, length 0
12:55:20.804023 6c97d68d563eb_3 Out ifindex 69 0a:58:66:66:00:01 ethertype IPv4 (0x0800), length 60: (tos 0x0, ttl 62, id 0, offset 0, flags [DF], proto TCP (6), length 40)
    172.18.0.3.47870 > 102.102.0.4.8080: Flags [R], cksum 0xec23 (correct), seq 399490783, win 0, length 0
12:55:21.015117 eth0  In  ifindex 2 82:5f:93:13:a3:eb ethertype IPv4 (0x0800), length 160: (tos 0x0, ttl 61, id 2690, offset 0, flags [DF], proto TCP (6), length 140)
    172.18.0.3.47870 > 172.18.0.4.31881: Flags [P.], cksum 0x58aa (incorrect -> 0x8b13), seq 1:89, ack 1, win 510, options [nop,nop,TS val 1732271500 ecr 2410724979], length 88
12:55:21.015152 breth0 In  ifindex 6 82:5f:93:13:a3:eb ethertype IPv4 (0x0800), length 160: (tos 0x0, ttl 61, id 2690, offset 0, flags [DF], proto TCP (6), length 140)
    172.18.0.3.47870 > 172.18.0.4.31881: Flags [P.], cksum 0x58aa (incorrect -> 0x8b13), seq 1:89, ack 1, win 510, options [nop,nop,TS val 1732271500 ecr 2410724979], length 88
12:55:21.015224 ovn-k8s-mp13 Out ifindex 64 0a:58:66:66:00:02 ethertype IPv4 (0x0800), length 160: (tos 0x0, ttl 60, id 2690, offset 0, flags [DF], proto TCP (6), length 140)
    172.18.0.3.47870 > 169.254.0.3.31881: Flags [P.], cksum 0x5695 (incorrect -> 0x8d28), seq 1:89, ack 1, win 510, options [nop,nop,TS val 1732271500 ecr 2410724979], length 88
12:55:21.015264 6c97d68d563eb_3 Out ifindex 69 0a:58:66:66:00:01 ethertype IPv4 (0x0800), length 160: (tos 0x0, ttl 59, id 2690, offset 0, flags [DF], proto TCP (6), length 140)
    172.18.0.3.47870 > 102.102.0.4.8080: Flags [P.], cksum 0x12fe (incorrect -> 0x2db9), seq 1:89, ack 1, win 510, options [nop,nop,TS val 1732271500 ecr 2410724979], length 88: HTTP, length: 88
	GET /hostname HTTP/1.1
	Host: 172.18.0.4:31881
	User-Agent: curl/8.12.1
	Accept: */*
	
12:55:21.015321 6c97d68d563eb_3 P   ifindex 69 0a:58:66:66:00:04 ethertype IPv4 (0x0800), length 60: (tos 0x0, ttl 64, id 0, offset 0, flags [DF], proto TCP (6), length 40)
    102.102.0.4.8080 > 172.18.0.3.47870: Flags [R], cksum 0xa5dc (correct), seq 1742714134, win 0, length 0
12:55:21.015373 ovn-k8s-mp13 In  ifindex 64 0a:58:66:66:00:01 ethertype IPv4 (0x0800), length 60: (tos 0x0, ttl 63, id 0, offset 0, flags [DF], proto TCP (6), length 40)
    169.254.0.3.31881 > 172.18.0.3.47870: Flags [R], cksum 0x054c (correct), seq 1742714134, win 0, length 0
12:55:21.015477 breth0 Out ifindex 6 5e:13:4e:d9:eb:df ethertype IPv4 (0x0800), length 60: (tos 0x0, ttl 62, id 0, offset 0, flags [DF], proto TCP (6), length 40)
    172.18.0.4.31881 > 172.18.0.3.47870: Flags [R], cksum 0x0337 (correct), seq 1742714134, win 0, length 0
12:55:21.015502 eth0  Out ifindex 2 5e:13:4e:d9:eb:df ethertype IPv4 (0x0800), length 60: (tos 0x0, ttl 62, id 0, offset 0, flags [DF], proto TCP (6), length 40)
    172.18.0.4.31881 > 172.18.0.3.47870: Flags [R], cksum 0x0337 (correct), seq 1742714134, win 0, length 0
^C
30 packets captured
30 packets received by filter
0 packets dropped by kernel
```

The strange part is the RESET that is sent by OVN from ovn-worker. It's happening because for whatever reason OVN seems to be SNATing the PACK to the masqueradeIP of the UDN (169.254.0.36) but doesn't seem to do that for the SYNACK. Typically, this SNAT should be done only for any new packets or any replies that are not tracked as part of onward connection in conntrack which makes OVN treat it as a new connection. But in our case, its clearly showing that all responses after SYNACK coming from the backend are getting screwed up due to the SNAT.

In our case, the backend's packets after SYN-ACK are the ones failing:
```
Backend sends: 102.102.0.4.8080 > 172.18.0.3.49750 [.]   ← ACK (gets SNAT'd to 169.254.0.36 ✗)
Backend sends: 102.102.0.4.8080 > 172.18.0.3.49750 [P.]  ← PUSH+ACK with HTTP response (also SNAT'd ✗)
```
The SYN-ACK from backend is correctly un-DNAT'd to 169.254.0.3:31881, but all subsequent packets from the backend (ACKs and PUSH+ACKs) are incorrectly SNAT'd to 169.254.0.36:random.
So the bug affects all backend-originated packets after the SYN-ACK - both pure ACKs and PUSH+ACKs.

the un-DNAT that OVN needs to do from 0.4 backend podIP to magic IP 0.3 never happens because seems like that packet coming from 0.4 is getting SNATed to 0.36 for some reason. Q is why are those Packets getting SNATed while SYNACK isn't?

Also capturing conntrack states here from ovn-worker node:

```
    [NEW] tcp      6 120 SYN_SENT src=172.18.0.3 dst=172.18.0.4 sport=47870 dport=31881 [UNREPLIED] src=169.254.0.3 dst=172.18.0.3 sport=31881 dport=47870
    [NEW] tcp      6 120 SYN_SENT src=172.18.0.3 dst=169.254.0.3 sport=47870 dport=31881 [UNREPLIED] src=102.102.0.4 dst=172.18.0.3 sport=8080 dport=47870 mark=2 zone=29
    [NEW] tcp      6 120 SYN_SENT src=172.18.0.3 dst=102.102.0.4 sport=47870 dport=8080 [UNREPLIED] src=102.102.0.4 dst=172.18.0.3 sport=8080 dport=47870 zone=62
 [UPDATE] tcp      6 60 SYN_RECV src=172.18.0.3 dst=172.18.0.4 sport=47870 dport=31881 src=169.254.0.3 dst=172.18.0.3 sport=31881 dport=47870
 [UPDATE] tcp      6 300 ESTABLISHED src=172.18.0.3 dst=172.18.0.4 sport=47870 dport=31881 src=169.254.0.3 dst=172.18.0.3 sport=31881 dport=47870 [ASSURED]
    [NEW] tcp      6 300 ESTABLISHED src=102.102.0.4 dst=172.18.0.3 sport=8080 dport=47870 [UNREPLIED] src=172.18.0.3 dst=169.254.0.36 sport=47870 dport=33656 zone=24
    [NEW] tcp      6 300 ESTABLISHED src=169.254.0.36 dst=172.18.0.3 sport=33656 dport=47870 [UNREPLIED] src=172.18.0.3 dst=169.254.0.36 sport=47870 dport=33656 zone=29
    [NEW] tcp      6 300 ESTABLISHED src=169.254.0.36 dst=172.18.0.3 sport=33656 dport=47870 [UNREPLIED] src=172.18.0.3 dst=172.18.0.4 sport=47870 dport=33656
[DESTROY] tcp      6 300 CLOSE src=169.254.0.36 dst=172.18.0.3 sport=33656 dport=47870 [UNREPLIED] src=172.18.0.3 dst=172.18.0.4 sport=47870 dport=33656
```

```
sh-5.2# ovn-nbctl list nat 0067db1c-39e7-4f39-a502-db2cdd65df37
_uuid               : 0067db1c-39e7-4f39-a502-db2cdd65df37
allowed_ext_ips     : []
exempted_ext_ips    : []
external_ids        : {"k8s.ovn.org/network"=cluster_udn_bgp-udn-layer3-network-a, "k8s.ovn.org/topology"=layer3}
external_ip         : "169.254.0.36"
external_mac        : []
external_port_range : "32768-60999"
gateway_port        : []
logical_ip          : "102.102.0.0/24"
logical_port        : rtos-cluster_udn_bgp.udn.layer3.network.a_ovn-worker
match               : "eth.dst == 0a:58:66:66:00:02 && (ip4.dst == $a712973235162149816 || ip4.dst == $a3613486944346402462)"
options             : {stateless="false"}
priority            : 0
type                : snat
```

Looking at the conntrack events:

```
For SYN (incoming):
zone=29: 172.18.0.3 → 169.254.0.3:31881 → reply: 102.102.0.4 → 172.18.0.3 (LB DNAT)
For backend's ACK (first established reply):
zone=24: 102.102.0.4 → 172.18.0.3 → reply: 172.18.0.3 → 169.254.0.36:33656  ← NEW entry with SNAT!zone=29: 169.254.0.36 → 172.18.0.3 → ...  ← Now using SNAT'd address!
```
The order of operations is wrong somewhere:

Backend sends: 102.102.0.4:8080 → 172.18.0.3
SNAT (zone=24) is checked/applied FIRST - packet matches ip4.src == 102.102.0.0/24, gets SNAT'd to 169.254.0.36:33656
LB un-DNAT (zone=29) never gets a chance - the src is already changed to 169.254.0.36
For SYN-ACK, the LB un-DNAT must happen first (changing src to 169.254.0.3:31881), so when the packet reaches the SNAT stage, ip4.src is 169.254.0.3, which doesn't match 102.102.0.0/24, so SNAT is skipped.

The bug: For established packets, the masquerade SNAT in zone=24 is being applied BEFORE the LB un-DNAT in zone=29 can transform the source. The SNAT corrupts the packet before un-DNAT has a chance to fix it.

We need to understand why est pkts are getting SNATed by OVN and why its not considered as reply to existing connection?

Well this was an OVN Bug: https://issues.redhat.com/browse/FDP-787
We just need to use `ct-commit-all` on the LR: https://issues.redhat.com/browse/OCPBUGS-50912

**Comment by ricky-rav** [comment]
Re-enabled by https://github.com/ovn-kubernetes/ovn-kubernetes/pull/6435/changes/b347534847e78ae5a54c2f5b1fa7c35be7e2ee46 and fixed by the same PR.
