### ISSUE TITLE
UDN pod in networkA should be able to talk to UDN pod in networkB's nodeport service on the same node

### ISSUE THREAD

**Issue by tssurya** [ovn-kubernetes/ovn-kubernetes#5419]
### What happened?

pod in UDN A -> sameNodeIP:NodePort i.e [172.18.0.2:30724](tel:1721830724)

1. pod (102.102.2.4)-> ovn-switch->ovn-cluster-router (SNAT to masqueradeIP 169.254.0.14)->
2. LRP send to mpX ->
3. in the host (IPTable DNAT from nodePort to clusterIP 10.96.96.233:8080)
4. send to breth0
5. breth0 flows reroute packet to UDN B's patchport
6. hits the GR of UDNB and DNATs from clusterIP to backend pod that lives on another node (103.103.1.5) at the same time SNAT to joinIP in
7. OVN router i.e 100.65.0.4
8. reponse comes back from remote pod
9. and then backhole
```
tcpdump: data link type LINUX_SLL2
tcpdump: listening on any, link-type LINUX_SLL2 (Linux cooked v2), snapshot length 262144 bytes
08:57:41.989038 865a53b516350_3 P   ifindex 19 0a:58:66:66:02:04 ethertype IPv4 (0x0800), length 80: (tos 0x0, ttl 64, id 37284, offset 0, flags [DF], proto TCP (6), length 60)
    102.102.2.4.44762 > 172.18.0.2.30724: Flags [S], cksum 0x14ad (incorrect -> 0x86a5), seq 782590826, win 65280, options [mss 1360,sackOK,TS val 1239526255 ecr 0,nop,wscale 7], length 0
08:57:41.989777 ovn-k8s-mp2 In  ifindex 14 0a:58:66:66:02:01 ethertype IPv4 (0x0800), length 80: (tos 0x0, ttl 63, id 37284, offset 0, flags [DF], proto TCP (6), length 60)
    169.254.0.14.56754 > 172.18.0.2.30724: Flags [S], cksum 0x162b (correct), seq 782590826, win 65280, options [mss 1360,sackOK,TS val 1239526255 ecr 0,nop,wscale 7], length 0
08:57:41.989798 breth0 Out ifindex 6 6a:ed:17:fb:28:bd ethertype IPv4 (0x0800), length 80: (tos 0x0, ttl 62, id 37284, offset 0, flags [DF], proto TCP (6), length 60)
    169.254.0.14.56754 > 10.96.96.233.8080: Flags [S], cksum 0xaf6a (correct), seq 782590826, win 65280, options [mss 1360,sackOK,TS val 1239526255 ecr 0,nop,wscale 7], length 0
08:57:41.990364 genev_sys_6081 Out ifindex 7 0a:58:64:58:00:04 ethertype IPv4 (0x0800), length 80: (tos 0x0, ttl 60, id 37284, offset 0, flags [DF], proto TCP (6), length 60)
    100.65.0.4.56754 > 103.103.1.5.8080: Flags [S], cksum 0xf80e (correct), seq 782590826, win 65280, options [mss 1360,sackOK,TS val 1239526255 ecr 0,nop,wscale 7], length 0
08:57:41.991322 genev_sys_6081 P   ifindex 7 0a:58:64:58:00:02 ethertype IPv4 (0x0800), length 80: (tos 0x0, ttl 63, id 0, offset 0, flags [DF], proto TCP (6), length 60)
    103.103.1.5.8080 > 100.65.0.4.56754: Flags [S.], cksum 0xc001 (correct), seq 3536686766, ack 782590827, win 64704, options [mss 1360,sackOK,TS val 1866885497 ecr 1239526255,nop,wscale 7], length 0
08:57:43.004810 genev_sys_6081 P   ifindex 7 0a:58:64:58:00:02 ethertype IPv4 (0x0800), length 80: (tos 0x0, ttl 63, id 0, offset 0, flags [DF], proto TCP (6), length 60)
    103.103.1.5.8080 > 100.65.0.4.56754: Flags [S.], cksum 0xccdf (incorrect -> 0xbc0b), seq 3536686766, ack 782590827, win 64704, options [mss 1360,sackOK,TS val 1866886511 ecr 1239526255,nop,wscale 7], length 0
08:57:43.005526 865a53b516350_3 P   ifindex 19 0a:58:66:66:02:04 ethertype IPv4 (0x0800), length 80: (tos 0x0, ttl 64, id 37285, offset 0, flags [DF], proto TCP (6), length 60)
    102.102.2.4.44762 > 172.18.0.2.30724: Flags [S], cksum 0x14ad (incorrect -> 0x82ac), seq 782590826, win 65280, options [mss 1360,sackOK,TS val 1239527272 ecr 0,nop,wscale 7], length 0
```
we see an ARP towards 169.254.0.14 which then goes unreplied.. Q is who is arping and why? -> because networkB now needs to know how to route this traffic back to network A - it arps for the masqueradeIP of networkA. we don't have any kind of mac bindings for cross networks.. so this is as expected?

```
2025-07-28T10:07:01.196Z|00006|vconn(ovn_pinctrl0)|DBG|unix:/var/run/openvswitch/br-int.mgmt: sent (Success): OFPT_PACKET_OUT (OF1.5) (xid=0x2e02): in_port=CONTROLLER actions=set_field:0xa9fe000e->reg0,set_field:0xa9fe000f->reg1,set_field:0x4->reg9,set_field:0x1->reg10,set_field:0x3e->reg11,set_field:0x42->reg12,set_field:0x3d->reg13,set_field:0x2->reg14,set_field:0x1->reg15,set_field:0x14->metadata,set_field:ff:ff:ff:ff:ff:ff->eth_dst,move:NXM_NX_XXREG0[64..95]->NXM_OF_ARP_SPA[],move:NXM_NX_XXREG0[96..127]->NXM_OF_ARP_TPA[],set_field:1->arp_op,resubmit(,40) data_len=42
arp,vlan_tci=0x0000,dl_src=6a:ed:17:fb:28:bd,dl_dst=00:00:00:00:00:00,arp_spa=103.103.1.5,arp_tpa=169.254.0.14,arp_op=1,arp_sha=6a:ed:17:fb:28:bd,arp_tha=00:00:00:00:00:00
```

### What did you expect to happen?

response should not get blackholed and we need to find a way to have mac bindings for cross network masqueradeIP traffic if we really want this traffic to work.

### How can we reproduce it (as minimally and precisely as possible)?

always on the test:

```
UDN pod to a different node nodeport service in different UDN network should work
```
i.e right now it doesn't work but try to make it work and you see response is screwed.

### OVN-Kubernetes version

<details>

```console
$ ovnkube --version
# paste output here
```

</details>

### Kubernetes version

<details>

```console
$ kubectl version
# paste output here
```

</details>

### OVN version

<details>

```console
$ oc rsh -n ovn-kubernetes ovnkube-node-xxxxx (pick any ovnkube-node pod on your cluster)
$ rpm -q ovn
# paste output here
```

</details>

### OVS version

<details>

```console
$ oc rsh -n ovn-kubernetes ovs-node-xxxxx (pick any ovs pod on your cluster)
$ rpm -q openvswitch
# paste output here
```

</details>

### Platform

<details>

Is it baremetal? GCP? AWS? Azure?
</details>

### OS version

<details>

```console
# On Linux:
$ cat /etc/os-release
# paste output here
$ uname -a
# paste output here

# On Windows:
C:\> wmic os get Caption, Version, BuildNumber, OSArchitecture
# paste output here
```

</details>

### Install tools

<details>

</details>

### Container runtime (CRI) and version (if applicable)

<details>

</details>

**Comment by tssurya** [comment]
this bug is applicable to both UDNs and advertised UDNs - tested it on both

**Comment by tssurya** [comment]
NOTE: This was always the case that this doesn't work.. we thought this started working 2 weeks ago when we merged the pkt_mark flow changes but seems like not? anyways I will look into this after PR 5140 merges.

**Comment by tssurya** [comment]
v4 behaviour is well understood:

```
root@ovn-control-plane:/# tcpdump -i any -nneev port 36363 or port 30163 or host 169.254.0.16 or host 10.96.181.6 or host 100.65.0.2
tcpdump: data link type LINUX_SLL2
tcpdump: listening on any, link-type LINUX_SLL2 (Linux cooked v2), snapshot length 262144 bytes
17:28:02.703410 0ff441c4eec64_3 P   ifindex 25 0a:58:66:66:00:04 ethertype IPv4 (0x0800), length 80: (tos 0x0, ttl 64, id 49568, offset 0, flags [DF], proto TCP (6), length 60)
    102.102.0.4.41200 > 172.18.0.3.30163: Flags [S], cksum 0x12ae (incorrect -> 0x3e75), seq 1497678918, win 65280, options [mss 1360,sackOK,TS val 3527864792 ecr 0,nop,wscale 7], length 0
17:28:02.704202 ovn-k8s-mp3 In  ifindex 20 0a:58:64:41:00:02 ethertype IPv4 (0x0800), length 80: (tos 0x0, ttl 63, id 49568, offset 0, flags [DF], proto TCP (6), length 60)
    169.254.0.16.49641 > 172.18.0.3.30163: Flags [S], cksum 0xd9d7 (correct), seq 1497678918, win 65280, options [mss 1360,sackOK,TS val 3527864792 ecr 0,nop,wscale 7], length 0
17:28:02.704223 breth0 Out ifindex 6 22:bb:02:61:0d:2e ethertype IPv4 (0x0800), length 80: (tos 0x0, ttl 62, id 49568, offset 0, flags [DF], proto TCP (6), length 60)
    169.254.0.16.49641 > 10.96.181.6.8080: Flags [S], cksum 0x1cca (correct), seq 1497678918, win 65280, options [mss 1360,sackOK,TS val 3527864792 ecr 0,nop,wscale 7], length 0
17:28:02.704645 d2b5b8adab427_3 Out ifindex 29 0a:58:64:41:00:02 ethertype IPv4 (0x0800), length 80: (tos 0x0, ttl 61, id 49568, offset 0, flags [DF], proto TCP (6), length 60)
    100.65.0.2.49641 > 103.103.0.7.8080: Flags [S], cksum 0xba8d (correct), seq 1497678918, win 65280, options [mss 1360,sackOK,TS val 3527864792 ecr 0,nop,wscale 7], length 0
17:28:02.704762 d2b5b8adab427_3 P   ifindex 29 0a:58:67:67:00:07 ethertype IPv4 (0x0800), length 80: (tos 0x0, ttl 64, id 0, offset 0, flags [DF], proto TCP (6), length 60)
    103.103.0.7.8080 > 100.65.0.2.49641: Flags [S.], cksum 0xcbdf (incorrect -> 0x712e), seq 77790633, ack 1497678919, win 64704, options [mss 1360,sackOK,TS val 3530258134 ecr 3527864792,nop,wscale 7], length 0
17:28:02.705407 eth0  Out ifindex 2 22:bb:02:61:0d:2e ethertype ARP (0x0806), length 48: Ethernet (len 6), IPv4 (len 4), Request who-has 169.254.0.16 tell 169.254.0.17, length 28
17:28:02.705453 breth0 B   ifindex 6 22:bb:02:61:0d:2e ethertype ARP (0x0806), length 48: Ethernet (len 6), IPv4 (len 4), Request who-has 169.254.0.16 tell 169.254.0.17, length 28
17:28:02.705821 eth0  In  ifindex 2 f6:20:82:72:5d:e5 ethertype ARP (0x0806), length 48: Ethernet (len 6), IPv4 (len 4), Reply 169.254.0.16 is-at f6:20:82:72:5d:e5, length 28
```

but ipv6 is doomed: in other words working on L2! NDP is flooding wow
```
17:31:57.267600 0ff441c4eec64_3 P   ifindex 25 0a:58:66:66:00:04 ethertype IPv6 (0x86dd), length 100: (flowlabel 0xca021, hlim 255, next-header TCP (6) payload length: 40) 2013:100:200::4.37012 > fc00:f853:ccd:e793::3.30163: Flags [S], cksum 0x0bfe (incorrect -> 0x912c), seq 286391935, win 64320, options [mss 1340,sackOK,TS val 2316505135 ecr 0,nop,wscale 7], length 0
17:31:57.268369 ovn-k8s-mp3 In  ifindex 20 0a:58:64:41:00:02 ethertype IPv6 (0x86dd), length 100: (flowlabel 0xca021, hlim 254, next-header TCP (6) payload length: 40) fd69::10.40122 > fc00:f853:ccd:e793::3.30163: Flags [S], cksum 0xaaa3 (correct), seq 286391935, win 64320, options [mss 1340,sackOK,TS val 2316505135 ecr 0,nop,wscale 7], length 0
17:31:57.268394 breth0 Out ifindex 6 22:bb:02:61:0d:2e ethertype IPv6 (0x86dd), length 100: (flowlabel 0xca021, hlim 253, next-header TCP (6) payload length: 40) fd69::10.40122 > fd00:10:96::9a20.8080: Flags [S], cksum 0x51d8 (correct), seq 286391935, win 64320, options [mss 1340,sackOK,TS val 2316505135 ecr 0,nop,wscale 7], length 0
17:31:57.268733 genev_sys_6081 Out ifindex 7 0a:58:64:41:00:02 ethertype IPv6 (0x86dd), length 100: (flowlabel 0xca021, hlim 252, next-header TCP (6) payload length: 40) fd99::2.40122 > 2014:100:200::5.8080: Flags [S], cksum 0xc664 (correct), seq 286391935, win 64320, options [mss 1340,sackOK,TS val 2316505135 ecr 0,nop,wscale 7], length 0
17:31:57.269715 genev_sys_6081 P   ifindex 7 0a:58:67:67:00:05 ethertype IPv6 (0x86dd), length 100: (flowlabel 0x33712, hlim 255, next-header TCP (6) payload length: 40) 2014:100:200::5.8080 > fd99::2.40122: Flags [S.], cksum 0x6cad (correct), seq 1733720754, ack 286391936, win 65072, options [mss 1340,sackOK,TS val 2133652864 ecr 2316505135,nop,wscale 7], length 0
17:31:57.271003 eth0  In  ifindex 2 3a:69:37:0b:3f:56 ethertype IPv6 (0x86dd), length 92: (hlim 255, next-header ICMPv6 (58) payload length: 32) fd69::10 > fe80::20bb:2ff:fe61:d2e: [icmp6 sum ok] ICMP6, neighbor advertisement, length 32, tgt is fd69::10, Flags [solicited, override]
	  destination link-address option (2), length 8 (1): 3a:69:37:0b:3f:56
17:31:57.271267 eth0  In  ifindex 2 f6:20:82:72:5d:e5 ethertype IPv6 (0x86dd), length 92: (hlim 255, next-header ICMPv6 (58) payload length: 32) fd69::10 > fe80::20bb:2ff:fe61:d2e: [icmp6 sum ok] ICMP6, neighbor advertisement, length 32, tgt is fd69::10, Flags [solicited, override]
	  destination link-address option (2), length 8 (1): f6:20:82:72:5d:e5
17:31:57.271279 breth0 In  ifindex 6 3a:69:37:0b:3f:56 ethertype IPv6 (0x86dd), length 92: (hlim 255, next-header ICMPv6 (58) payload length: 32) fd69::10 > fe80::20bb:2ff:fe61:d2e: [icmp6 sum ok] ICMP6, neighbor advertisement, length 32, tgt is fd69::10, Flags [solicited, override]
	  destination link-address option (2), length 8 (1): 3a:69:37:0b:3f:56
17:31:57.271438 breth0 In  ifindex 6 f6:20:82:72:5d:e5 ethertype IPv6 (0x86dd), length 92: (hlim 255, next-header ICMPv6 (58) payload length: 32) fd69::10 > fe80::20bb:2ff:fe61:d2e: [icmp6 sum ok] ICMP6, neighbor advertisement, length 32, tgt is fd69::10, Flags [solicited, override]
	  destination link-address option (2), length 8 (1): f6:20:82:72:5d:e5
17:31:57.272401 breth0 In  ifindex 6 f6:20:82:72:5d:e5 ethertype IPv6 (0x86dd), length 100: (flowlabel 0x33712, hlim 254, next-header TCP (6) payload length: 40) fd00:10:96::9a20.8080 > fd69::10.40122: Flags [S.], cksum 0xf820 (correct), seq 1733720754, ack 286391936, win 65072, options [mss 1340,sackOK,TS val 2133652864 ecr 2316505135,nop,wscale 7], length 0
17:31:57.272413 ovn-k8s-mp3 Out ifindex 20 0a:58:66:66:00:02 ethertype IPv6 (0x86dd), length 100: (flowlabel 0x33712, hlim 253, next-header TCP (6) payload length: 40) fc00:f853:ccd:e793::3.30163 > fd69::10.40122: Flags [S.], cksum 0x50ec (correct), seq 1733720754, ack 286391936, win 65072, options [mss 1340,sackOK,TS val 2133652864 ecr 2316505135,nop,wscale 7], length 0
17:31:57.272788 0ff441c4eec64_3 Out ifindex 25 0a:58:64:41:00:02 ethertype IPv6 (0x86dd), length 100: (flowlabel 0x33712, hlim 252, next-header TCP (6) payload length: 40) fc00:f853:ccd:e793::3.30163 > 2013:100:200::4.37012: Flags [S.], cksum 0x3775 (correct), seq 1733720754, ack 286391936, win 65072, options [mss 1340,sackOK,TS val 2133652864 ecr 2316505135,nop,wscale 7], length 0
```

**Comment by tssurya** [comment]
thanks to @kyrtapz who pointed out we had flows like this : https://github.com/ovn-kubernetes/ovn-kubernetes/blob/6a969b41eae55f7b251479392cf716b9c0e8bfd5/go-controller/pkg/node/bridgeconfig/bridgeflows.go#L812-L818

This is why V6 is behaving different from V4! As soon as I did a cluster commenting out these lines... IPV6 stopped working.
Special thing about L2 networks is already the fact that the masqueradeIP SNATs are on the GR so its enough to flood and things will kick in


so on a cluster with those flows disabled:

IPV4:
```
tcpdump: data link type LINUX_SLL2
tcpdump: verbose output suppressed, use -v[v]... for full protocol decode
listening on any, link-type LINUX_SLL2 (Linux cooked v2), snapshot length 262144 bytes
18:21:12.948766 7a3af3859681c_3 P   ifindex 38 0a:58:66:66:00:04 ethertype IPv4 (0x0800), length 80: 102.102.0.4.36363 > 172.18.0.2.30265: Flags [S], seq 3141481877, win 65280, options [mss 1360,sackOK,TS val 4025298186 ecr 0,nop,wscale 7], length 0
18:21:12.949510 ovn-k8s-mp7 In  ifindex 33 0a:58:64:41:00:04 ethertype IPv4 (0x0800), length 80: 169.254.0.24.40530 > 172.18.0.2.30265: Flags [S], seq 3141481877, win 65280, options [mss 1360,sackOK,TS val 4025298186 ecr 0,nop,wscale 7], length 0
18:21:12.949525 breth0 Out ifindex 6 ea:e2:66:9c:9e:f0 ethertype IPv4 (0x0800), length 80: 169.254.0.24.40530 > 10.96.114.146.8080: Flags [S], seq 3141481877, win 65280, options [mss 1360,sackOK,TS val 4025298186 ecr 0,nop,wscale 7], length 0
18:21:12.949934 genev_sys_6081 Out ifindex 7 0a:58:64:41:00:04 ethertype IPv4 (0x0800), length 80: 100.65.0.4.40530 > 103.103.0.5.8080: Flags [S], seq 3141481877, win 65280, options [mss 1360,sackOK,TS val 4025298186 ecr 0,nop,wscale 7], length 0
18:21:12.950656 genev_sys_6081 P   ifindex 7 0a:58:64:41:00:02 ethertype IPv4 (0x0800), length 72: 103.103.0.5.8080 > 100.65.0.4.40530: Flags [.], ack 2784196859, win 505, options [nop,nop,TS val 3266267764 ecr 4025275320], length 0
18:21:12.950663 breth0 In  ifindex 6 aa:ea:d0:7a:32:aa ethertype IPv4 (0x0800), length 72: 10.96.114.146.8080 > 169.254.0.24.40530: Flags [.], ack 2784196859, win 505, options [nop,nop,TS val 3266267764 ecr 4025275320], length 0
18:21:12.950669 ovn-k8s-mp7 Out ifindex 33 0a:58:66:66:00:02 ethertype IPv4 (0x0800), length 72: 172.18.0.2.30265 > 169.254.0.24.40530: Flags [.], ack 2784196859, win 505, options [nop,nop,TS val 3266267764 ecr 4025275320], length 0
18:21:13.979174 7a3af3859681c_3 P   ifindex 38 0a:58:66:66:00:04 ethertype IPv4 (0x0800), length 80: 102.102.0.4.36363 > 172.18.0.2.30265: Flags [S], seq 3141481877, win 65280, options [mss 1360,sackOK,TS val 4025299217 ecr 0,nop,wscale 7], length 0
18:21:13.979247 ovn-k8s-mp7 In  ifindex 33 0a:58:64:41:00:04 ethertype IPv4 (0x0800), length 80: 169.254.0.24.40530 > 172.18.0.2.30265: Flags [S], seq 3141481877, win 65280, options [mss 1360,sackOK,TS val 4025299217 ecr 0,nop,wscale 7], length 0
18:21:13.979280 breth0 Out ifindex 6 ea:e2:66:9c:9e:f0 ethertype IPv4 (0x0800), length 80: 169.254.0.24.40530 > 10.96.114.146.8080: Flags [S], seq 3141481877, win 65280, options [mss 1360,sackOK,TS val 4025299217 ecr 0,nop,wscale 7], length 0
18:21:13.979320 genev_sys_6081 Out ifindex 7 0a:58:64:41:00:04 ethertype IPv4 (0x0800), length 80: 100.65.0.4.40530 > 103.103.0.5.8080: Flags [S], seq 3141481877, win 65280, options [mss 1360,sackOK,TS val 4025299217 ecr 0,nop,wscale 7], length 0
18:21:13.979520 genev_sys_6081 P   ifindex 7 0a:58:64:41:00:02 ethertype IPv4 (0x0800), length 72: 103.103.0.5.8080 > 100.65.0.4.40530: Flags [.], ack 1, win 505, options [nop,nop,TS val 3266268793 ecr 4025275320], length 0
18:21:13.979525 breth0 In  ifindex 6 aa:ea:d0:7a:32:aa ethertype IPv4 (0x0800), length 72: 10.96.114.146.8080 > 169.254.0.24.40530: Flags [.], ack 1, win 505, options [nop,nop,TS val 3266268793 ecr 4025275320], length 0
18:21:13.979528 ovn-k8s-mp7 Out ifindex 33 0a:58:66:66:00:02 ethertype IPv4 (0x0800), length 72: 172.18.0.2.30265 > 169.254.0.24.40530: Flags [.], ack 1, win 505, options [nop,nop,TS val 3266268793 ecr 4025275320], length 0
18:21:18.139186 ovn-k8s-mp7 Out ifindex 33 0a:58:66:66:00:02 ethertype ARP (0x0806), length 48: Request who-has 169.254.0.24 tell 102.102.0.2, length 28
18:21:18.139628 ovn-k8s-mp7 In  ifindex 33 0a:58:64:41:00:04 ethertype ARP (0x0806), length 48: Reply 169.254.0.24 is-at 0a:58:64:41:00:04, length 28
18:21:18.139649 genev_sys_6081 Out ifindex 7 0a:58:66:66:00:02 ethertype ARP (0x0806), length 48: Request who-has 169.254.0.24 tell 102.102.0.2, length 28
18:21:18.139728 genev_sys_6081 Out ifindex 7 0a:58:66:66:00:02 ethertype ARP (0x0806), length 48: Request who-has 169.254.0.24 tell 102.102.0.2, length 28
18:21:18.139741 genev_sys_6081 Out ifindex 7 0a:58:66:66:00:02 ethertype ARP (0x0806), length 48: Request who-has 169.254.0.24 tell 102.102.0.2, length 28
18:21:21.724065 genev_sys_6081 P   ifindex 7 0a:58:64:41:00:02 ethertype IPv4 (0x0800), length 80: 103.103.0.5.8080 > 100.65.0.4.40530: Flags [S.], seq 620476035, ack 2784196859, win 64704, options [mss 1360,sackOK,TS val 3266276537 ecr 4025275320,nop,wscale 7], length 0
18:21:21.724095 breth0 In  ifindex 6 aa:ea:d0:7a:32:aa ethertype IPv4 (0x0800), length 80: 10.96.114.146.8080 > 169.254.0.24.40530: Flags [S.], seq 620476035, ack 2784196859, win 64704, options [mss 1360,sackOK,TS val 3266276537 ecr 4025275320,nop,wscale 7], length 0
18:21:21.724113 ovn-k8s-mp7 Out ifindex 33 0a:58:66:66:00:02 ethertype IPv4 (0x0800), length 80: 172.18.0.2.30265 > 169.254.0.24.40530: Flags [S.], seq 620476035, ack 2784196859, win 64704, options [mss 1360,sackOK,TS val 3266276537 ecr 4025275320,nop,wscale 7], length 0
```
AND IPV6
```
18:23:31.659585 7a3af3859681c_3 P   ifindex 38 0a:58:66:66:00:04 ethertype IPv6 (0x86dd), length 100: 2013:100:200::4.36363 > fc00:f853:ccd:e793::2.30265: Flags [S], seq 2340113569, win 64320, options [mss 1340,sackOK,TS val 3746445513 ecr 0,nop,wscale 7], length 0
18:23:31.660416 ovn-k8s-mp7 In  ifindex 33 0a:58:64:41:00:04 ethertype IPv6 (0x86dd), length 100: fd69::18.36424 > fc00:f853:ccd:e793::2.30265: Flags [S], seq 2340113569, win 64320, options [mss 1340,sackOK,TS val 3746445513 ecr 0,nop,wscale 7], length 0
18:23:31.660441 breth0 Out ifindex 6 ea:e2:66:9c:9e:f0 ethertype IPv6 (0x86dd), length 100: fd69::18.36424 > fd00:10:96::1f2e.8080: Flags [S], seq 2340113569, win 64320, options [mss 1340,sackOK,TS val 3746445513 ecr 0,nop,wscale 7], length 0
18:23:31.660790 genev_sys_6081 Out ifindex 7 0a:58:64:41:00:04 ethertype IPv6 (0x86dd), length 100: fd99::4.36424 > 2014:100:200::5.8080: Flags [S], seq 2340113569, win 64320, options [mss 1340,sackOK,TS val 3746445513 ecr 0,nop,wscale 7], length 0
18:23:31.661937 genev_sys_6081 P   ifindex 7 0a:58:67:67:00:05 ethertype IPv6 (0x86dd), length 100: 2014:100:200::5.8080 > fd99::4.36424: Flags [S.], seq 3108560630, ack 2340113570, win 65072, options [mss 1340,sackOK,TS val 1094217885 ecr 3746445513,nop,wscale 7], length 0
18:23:32.667462 genev_sys_6081 P   ifindex 7 0a:58:67:67:00:05 ethertype IPv6 (0x86dd), length 100: 2014:100:200::5.8080 > fd99::4.36424: Flags [S.], seq 3108560630, ack 2340113570, win 65072, options [mss 1340,sackOK,TS val 1094218891 ecr 3746445513,nop,wscale 7], length 0
18:23:32.668183 7a3af3859681c_3 P   ifindex 38 0a:58:66:66:00:04 ethertype IPv6 (0x86dd), length 100: 2013:100:200::4.36363 > fc00:f853:ccd:e793::2.30265: Flags [S], seq 2340113569, win 64320, options [mss 1340,sackOK,TS val 3746446523 ecr 0,nop,wscale 7], length 0
18:23:32.668243 ovn-k8s-mp7 In  ifindex 33 0a:58:64:41:00:04 ethertype IPv6 (0x86dd), length 100: fd69::18.36424 > fc00:f853:ccd:e793::2.30265: Flags [S], seq 2340113569, win 64320, options [mss 1340,sackOK,TS val 3746446523 ecr 0,nop,wscale 7], length 0
18:23:32.668277 breth0 Out ifindex 6 ea:e2:66:9c:9e:f0 ethertype IPv6 (0x86dd), length 100: fd69::18.36424 > fd00:10:96::1f2e.8080: Flags [S], seq 2340113569, win 64320, options [mss 1340,sackOK,TS val 3746446523 ecr 0,nop,wscale 7], length 0
18:23:32.669154 genev_sys_6081 Out ifindex 7 0a:58:64:41:00:04 ethertype IPv6 (0x86dd), length 100: fd99::4.36424 > 2014:100:200::5.8080: Flags [S], seq 2340113569, win 64320, options [mss 1340,sackOK,TS val 3746446523 ecr 0,nop,wscale 7], length 0
18:23:32.669950 genev_sys_6081 P   ifindex 7 0a:58:67:67:00:05 ethertype IPv6 (0x86dd), length 100: 2014:100:200::5.8080 > fd99::4.36424: Flags [S.], seq 3108560630, ack 2340113570, win 65072, options [mss 1340,sackOK,TS val 1094218893 ecr 3746445513,nop,wscale 7], length 0
18:23:34.715490 genev_sys_6081 P   ifindex 7 0a:58:67:67:00:05 ethertype IPv6 (0x86dd), length 100: 2014:100:200::5.8080 > fd99::4.36424: Flags [S.], seq 3108560630, ack 2340113570, win 65072, options [mss 1340,sackOK,TS val 1094220939 ecr 3746445513,nop,wscale 7], length 0
18:23:38.747253 genev_sys_6081 P   ifindex 7 0a:58:67:67:00:05 ethertype IPv6 (0x86dd), length 100: 2014:100:200::5.8080 > fd99::4.36424: Flags [S.], seq 3108560630, ack 2340113570, win 65072, options [mss 1340,sackOK,TS val 1094224971 ecr 3746445513,nop,wscale 7], length 0
18:23:47.132262 genev_sys_6081 P   ifindex 7 0a:58:67:67:00:05 ethertype IPv6 (0x86dd), length 100: 2014:100:200::5.8080 > fd99::4.36424: Flags [S.], seq 3108560630, ack 2340113570, win 65072, options [mss 1340,sackOK,TS val 1094233356 ecr 3746445513,nop,wscale 7], length 0
18:24:03.516069 genev_sys_6081 P   ifindex 7 0a:58:67:67:00:05 ethertype IPv6 (0x86dd), length 100: 2014:100:200::5.8080 > fd99::4.36424: Flags [S.], seq 3108560630, ack 2340113570, win 65072, options [mss 1340,sackOK,TS val 1094249739 ecr 3746445513,nop,wscale 7], length 0
18:24:08.635414 genev_sys_6081 P   ifindex 7 0a:58:67:67:00:05 ethertype IPv6 (0x86dd), length 92: fe80::858:67ff:fe67:5 > fd99::4: ICMP6, neighbor solicitation, who has fd99::4, length 32
18:24:08.636031 genev_sys_6081 Out ifindex 7 0a:58:64:41:00:04 ethertype IPv6 (0x86dd), length 92: fd99::4 > fe80::858:67ff:fe67:5: ICMP6, neighbor advertisement, tgt is fd99::4, length 32
````

now we see both behaving the same way :)

I will add a comment and do a new commit to explain why this behaves this way. and that too only on l2

**Comment by trozet** [comment]
@tssurya nit: the arp flows are missing in the description, so it was a little confusing at first. Might also be good to comment here what the intended fix is going to be. Are we just going to add mac bindings for the masq ips to every GR? also ovn_cluster_router?

The flood icmp flows were added really to ensure that when packets ingressed the physical interface, it would get flooded to the host and the default network GR. This was before UDN existed. Now that we have decoupled a bunch of flows from matching on physical interfaces, this unintentionally floods any RA/ND packet to all other other ports. This could have unintended side effects (like sending an ND message for a masq ip out of the physical interface). We should consider this with whatever our fix is going to be here.

**Comment by tssurya** [comment]
@trozet : at first I thought given we add MAC bindings for the host masquerade IPs today we can do that for other ones as well.. logically speaking its the right way.. but @jcaamano suggested a solution with yet another SNAT haha so SNAT to masqueradeIP followed by SNAT to host Masquerade  - I'm not sure if it'll break something else.. we'll know when after trying it out.

**Comment by tssurya** [comment]
## Investigation Update: IPv6 cross-UDN same-node nodeport now works, IPv4 still broken

While working on PR #6576 (masquerade IP mask narrowing to fix ARP storms), we discovered that the mask change **inadvertently fixes IPv6** cross-UDN same-node nodeport traffic. IPv4 remains broken due to a separate nftables/kernel issue.

### Root Cause Analysis

There are **two independent issues** at play. Both must be resolved for full cross-UDN same-node nodeport connectivity:

#### Issue 1: GR connected route vs static route (fixed by #6576 for IPv6)

**Before** the mask change, the UDN GR external port had a wide mask (e.g. `fd69::19/112`), giving the GR a connected route for the entire masquerade subnet. When networkB's GR needed to route the reply back to networkA's masquerade IP (`fd69::18`), it considered it directly connected and sent NDP for it on the external switch. Nobody owns that IP there, so NDP failed and the reply was dropped (this is the original ARP/NDP issue described in this bug).

**After** the mask change (`fd69::19/128`), the connected route only covers the GR's own IP. The static route `fd69::/112 -> fd69::4` now matches for other masquerade IPs, routing the reply to the management port gateway (`fd69::4`) which correctly delivers it back to networkA.

This fix applies equally to IPv4 (`169.254.0.0/17 -> 169.254.0.4`) and IPv6 (`fd69::/112 -> fd69::4`). However, IPv4 traffic never reaches this point because it's blocked earlier by Issue 2.

#### Issue 2: nftables `fib daddr type local` fails for IPv4 on management port (pre-existing, blocks IPv4)

Cross-UDN same-node nodeport traffic **always goes through the management port** in both local and shared gateway modes. The priority 1004 LRP on the cluster router reroutes traffic destined for the local node's IP to the management port. Confirmed with tcpdump on a shared gateway cluster:

```
# IPv4 - packet arrives on management port, gets SNATed to masquerade IP
f5ef86a73c564_3 P   IP 102.102.0.3.60298 > 172.18.0.4.31051: Flags [S] ...
ovn-k8s-mp1 In      IP 169.254.0.12.56201 > 172.18.0.4.31051: Flags [S] ...
```

On the host, the nftables `udn-service-prerouting` chain uses `fib daddr type local` to match nodeport traffic and set the UDN `pkt_mark`. This mark determines which UDN network's patch port the packet gets dispatched to in breth0 table 2.

**The problem**: the kernel's IPv4 FIB lookup in `fib daddr type local` is **interface-aware**. Since the node IP (e.g. `172.18.0.2`) is local on `breth0`, not on `ovn-k8s-mpX`, the lookup fails for IPv4:

```
$ ip route get 172.18.0.2 iif ovn-k8s-mp7
RTNETLINK answers: Invalid argument

$ ip -6 route get fc00:f853:ccd:e793::2 iif ovn-k8s-mp7
local fc00:f853:ccd:e793::2 from :: dev lo table local proto kernel metric 0 iif ovn-k8s-mp7 pref medium
```

#### Why the kernel behaves differently for IPv4 vs IPv6

This is a historical architectural difference in the Linux kernel's IPv4 vs IPv6 networking stacks:

**IPv4** (`inet_rtm_getroute` in `net/ipv4/route.c`): When `iif` is set, the code creates a fake skb and calls `ip_route_input_rcu()`. This path goes through `ip_route_input_slow()` which **unconditionally** calls `fib_validate_source()` (reverse path filtering) even for local destinations. Without a valid source address (defaults to `0.0.0.0`), RPF fails and the whole thing returns `EINVAL`. The source validation is deeply baked into IPv4's input route lookup path — you can't bypass it.

**IPv6** (`inet6_rtm_getroute` in `net/ipv6/route.c`): When `iif` is set, IPv6 calls `ip6_route_input_lookup()` which does a straightforward `fib6_table_lookup()`. It finds the local route and returns it. There's **no mandatory source/RPF validation** embedded in the IPv6 route lookup path the way there is in IPv4.

This same difference applies to nftables' `fib daddr type local` expression — under the hood it performs the same kernel FIB lookup, and inherits the same IPv4 RPF restriction when evaluating packets in the prerouting hook (where `iif` is the incoming interface).

### breth0 table 2 flow evidence

The OpenFlow counters on breth0 table 2 confirm the divergence:

```
# IPv6 hits the pkt_mark dispatch flow (priority 250) -> SUCCESS
cookie=0xdeff105, table=2, n_packets=18, n_bytes=1875, priority=250,pkt_mark=0x1008,ipv6 actions=mod_dl_dst:...,output:10

# IPv4 hits the masquerade IP drop flow (priority 200) -> DROPPED
cookie=0xdeff105, table=2, n_packets=4, n_bytes=296, priority=200,ip,nw_src=169.254.0.24 actions=drop

# IPv6 masquerade drop flow has 0 hits (mark bypasses it)
cookie=0xdeff105, table=2, n_packets=0, n_bytes=0, priority=200,ipv6,ipv6_src=fd69::18 actions=drop
```

### tcpdump evidence

**IPv4 (fails)** — packet enters management port, gets DNATed by nftables, sent to breth0, but dropped by table 2 isolation flow because `pkt_mark` was never set:
```
ovn-k8s-mp7 In  169.254.0.24.42007 > 172.18.0.2:31774 [S]
breth0 Out      169.254.0.24.37906 > 10.96.161.248:8080 [S]
(no reply — dropped by breth0 table 2 priority=200 nw_src=169.254.0.24)
```

**IPv6 (works)** — full TCP handshake completes:
```
ovn-k8s-mp7 In  fd69::18.56129 > fc00:f853:ccd:e793::2.31774 [S]
breth0 Out      fd69::18.56129 > fd00:10:96::c19.8080 [S]
breth0 In       fd00:10:96::c19.8080 > fd69::18.56129 [S.]
ovn-k8s-mp7 Out fc00:f853:ccd:e793::2.31774 > fd69::18.56129 [S.]
(full handshake, HTTP 200 OK)
```

### nftables marking chain

The `udn-service-prerouting` chain that sets the mark:
```
chain udn-service-mark {
    comment "UDN services packet mark"
    fib daddr type local meta l4proto . th dport vmap @udn-mark-nodeports
    ...
}

map udn-mark-nodeports {
    elements = { tcp . 31774 : jump udn-mark-0x1008 }
}

chain udn-mark-0x1008 {
    comment "cluster_udn_bgp-l3b: UDN packet marking"
    meta mark set 0x00001008
}
```

For IPv6, `fib daddr type local` matches -> mark is set -> breth0 table 2 dispatches to correct network.
For IPv4, `fib daddr type local` fails (interface-aware FIB/RPF) -> no mark -> dropped by isolation flow.

The original `pkt_mark` design (PR #4792) was intended for external clients hitting the node IP on `breth0`, not for cross-UDN traffic arriving on a UDN management port.

### Summary

| | IPv4 | IPv6 |
|---|---|---|
| `fib daddr type local` on mpX | Fails (RPF in input path) | Succeeds (no RPF) |
| pkt_mark set | No | Yes (0x1008) |
| breth0 table 2 | Dropped (priority 200) | Dispatched (priority 250) |
| GR reply routing (after #6576) | Would work if reached | Works |
| **End result** | **Broken** | **Fixed by #6576** |

To fix IPv4, the `fib daddr type local` check in the nftables chain needs to be made interface-agnostic for traffic arriving on `ovn-k8s-mpX`, or the marking mechanism needs to be reworked for cross-UDN traffic.

**Comment by tssurya** [comment]
ETP=cluster, layer2, v4 and v6 on shared gateway:
sh-5.3# tcpdump -i any -nneev tcp port 31047
tcpdump: WARNING: any: That device doesn't support promiscuous mode
(Promiscuous mode not supported on the "any" device)
dropped privs to tcpdump
tcpdump: listening on any, link-type LINUX_SLL2 (Linux cooked v2), snapshot length 262144 bytes


13:41:40.559624 dbbbf1da6bd0a_3 P   ifindex 31 0a:58:66:66:00:06 ethertype IPv6 (0x86dd), length 100: (flowlabel 0x428b7, hlim 255, next-header TCP (6), payload length 40) 2013:100:200::6.45192 > fc00:f853:ccd:e793::4.31047: Flags [S], cksum 0x0c01 (incorrect -> 0xea13), seq 458029505, win 64320, options [mss 1340,sackOK,TS val 956030836 ecr 0,nop,wscale 10], length 0
13:41:40.560129 ovn-k8s-mp5 In  ifindex 25 0a:58:66:66:00:01 ethertype IPv6 (0x86dd), length 100: (flowlabel 0x428b7, hlim 254, next-header TCP (6), payload length 40) fd69::14.42588 > fc00:f853:ccd:e793::4.31047: Flags [S], cksum 0x19db (correct), seq 458029505, win 64320, options [mss 1340,sackOK,TS val 956030836 ecr 0,nop,wscale 10], length 0
13:41:40.561955 ovn-k8s-mp5 Out ifindex 25 0a:58:66:66:00:02 ethertype IPv6 (0x86dd), length 100: (flowlabel 0x08ab0, hlim 252, next-header TCP (6), payload length 40) fc00:f853:ccd:e793::4.31047 > fd69::14.42588: Flags [S.], cksum 0x4cf4 (correct), seq 3365496113, ack 458029506, win 65072, options [mss 1340,sackOK,TS val 3700670342 ecr 956030836,nop,wscale 10], length 0
13:41:40.562230 dbbbf1da6bd0a_3 Out ifindex 31 0a:58:66:66:00:01 ethertype IPv6 (0x86dd), length 100: (flowlabel 0x08ab0, hlim 251, next-header TCP (6), payload length 40) fc00:f853:ccd:e793::4.31047 > 2013:100:200::6.45192: Flags [S.], cksum 0x1d2d (correct), seq 3365496113, ack 458029506, win 65072, options [mss 1340,sackOK,TS val 3700670342 ecr 956030836,nop,wscale 10], length 0
13:41:40.562252 dbbbf1da6bd0a_3 P   ifindex 31 0a:58:66:66:00:06 ethertype IPv6 (0x86dd), length 92: (flowlabel 0x428b7, hlim 255, next-header TCP (6), payload length 32) 2013:100:200::6.45192 > fc00:f853:ccd:e793::4.31047: Flags [.], cksum 0x0bf9 (incorrect -> 0x4973), ack 1, win 63, options [nop,nop,TS val 956030839 ecr 3700670342], length 0
13:41:40.562306 dbbbf1da6bd0a_3 P   ifindex 31 0a:58:66:66:00:06 ethertype IPv6 (0x86dd), length 193: (flowlabel 0x428b7, hlim 255, next-header TCP (6), payload length 133) 2013:100:200::6.45192 > fc00:f853:ccd:e793::4.31047: Flags [P.], cksum 0x0c5e (incorrect -> 0x6eb4), seq 1:102, ack 1, win 63, options [nop,nop,TS val 956030839 ecr 3700670342], length 101
13:41:40.562526 ovn-k8s-mp5 In  ifindex 25 0a:58:66:66:00:01 ethertype IPv6 (0x86dd), length 92: (flowlabel 0x428b7, hlim 254, next-header TCP (6), payload length 32) fd69::14.42588 > fc00:f853:ccd:e793::4.31047: Flags [.], cksum 0x793a (correct), ack 1, win 63, options [nop,nop,TS val 956030839 ecr 3700670342], length 0
13:41:40.562540 ovn-k8s-mp5 In  ifindex 25 0a:58:66:66:00:01 ethertype IPv6 (0x86dd), length 193: (flowlabel 0x428b7, hlim 254, next-header TCP (6), payload length 133) fd69::14.42588 > fc00:f853:ccd:e793::4.31047: Flags [P.], cksum 0x9e7b (correct), seq 1:102, ack 1, win 63, options [nop,nop,TS val 956030839 ecr 3700670342], length 101
13:41:40.563105 ovn-k8s-mp5 Out ifindex 25 0a:58:66:66:00:02 ethertype IPv6 (0x86dd), length 92: (flowlabel 0x08ab0, hlim 252, next-header TCP (6), payload length 32) fc00:f853:ccd:e793::4.31047 > fd69::14.42588: Flags [.], cksum 0xe65d (incorrect -> 0x78d2), ack 102, win 64, options [nop,nop,TS val 3700670344 ecr 956030839], length 0
13:41:40.563116 dbbbf1da6bd0a_3 Out ifindex 31 0a:58:66:66:00:01 ethertype IPv6 (0x86dd), length 92: (flowlabel 0x08ab0, hlim 251, next-header TCP (6), payload length 32) fc00:f853:ccd:e793::4.31047 > 2013:100:200::6.45192: Flags [.], cksum 0x0bf9 (incorrect -> 0x490b), ack 102, win 64, options [nop,nop,TS val 3700670344 ecr 956030839], length 0
13:41:40.563271 ovn-k8s-mp5 Out ifindex 25 0a:58:66:66:00:02 ethertype IPv6 (0x86dd), length 243: (flowlabel 0x08ab0, hlim 252, next-header TCP (6), payload length 183) fc00:f853:ccd:e793::4.31047 > fd69::14.42588: Flags [P.], cksum 0xe6f4 (incorrect -> 0x5cdc), seq 1:152, ack 102, win 64, options [nop,nop,TS val 3700670344 ecr 956030839], length 151
13:41:40.563282 dbbbf1da6bd0a_3 Out ifindex 31 0a:58:66:66:00:01 ethertype IPv6 (0x86dd), length 243: (flowlabel 0x08ab0, hlim 251, next-header TCP (6), payload length 183) fc00:f853:ccd:e793::4.31047 > 2013:100:200::6.45192: Flags [P.], cksum 0x0c90 (incorrect -> 0x2d15), seq 1:152, ack 102, win 64, options [nop,nop,TS val 3700670344 ecr 956030839], length 151
13:41:40.563290 dbbbf1da6bd0a_3 P   ifindex 31 0a:58:66:66:00:06 ethertype IPv6 (0x86dd), length 92: (flowlabel 0x428b7, hlim 255, next-header TCP (6), payload length 32) 2013:100:200::6.45192 > fc00:f853:ccd:e793::4.31047: Flags [.], cksum 0x0bf9 (incorrect -> 0x4874), ack 152, win 63, options [nop,nop,TS val 956030840 ecr 3700670344], length 0
13:41:40.563298 ovn-k8s-mp5 In  ifindex 25 0a:58:66:66:00:01 ethertype IPv6 (0x86dd), length 92: (flowlabel 0x428b7, hlim 254, next-header TCP (6), payload length 32) fd69::14.42588 > fc00:f853:ccd:e793::4.31047: Flags [.], cksum 0xe65d (incorrect -> 0x783b), ack 152, win 63, options [nop,nop,TS val 956030840 ecr 3700670344], length 0
13:41:40.563393 dbbbf1da6bd0a_3 P   ifindex 31 0a:58:66:66:00:06 ethertype IPv6 (0x86dd), length 92: (flowlabel 0x428b7, hlim 255, next-header TCP (6), payload length 32) 2013:100:200::6.45192 > fc00:f853:ccd:e793::4.31047: Flags [F.], cksum 0x0bf9 (incorrect -> 0x4873), seq 102, ack 152, win 63, options [nop,nop,TS val 956030840 ecr 3700670344], length 0
13:41:40.563402 ovn-k8s-mp5 In  ifindex 25 0a:58:66:66:00:01 ethertype IPv6 (0x86dd), length 92: (flowlabel 0x428b7, hlim 254, next-header TCP (6), payload length 32) fd69::14.42588 > fc00:f853:ccd:e793::4.31047: Flags [F.], cksum 0xe65d (incorrect -> 0x783a), seq 102, ack 152, win 63, options [nop,nop,TS val 956030840 ecr 3700670344], length 0
13:41:40.563499 ovn-k8s-mp5 Out ifindex 25 0a:58:66:66:00:02 ethertype IPv6 (0x86dd), length 92: (flowlabel 0x08ab0, hlim 252, next-header TCP (6), payload length 32) fc00:f853:ccd:e793::4.31047 > fd69::14.42588: Flags [F.], cksum 0xe65d (incorrect -> 0x7838), seq 152, ack 103, win 64, options [nop,nop,TS val 3700670344 ecr 956030840], length 0
13:41:40.563503 dbbbf1da6bd0a_3 Out ifindex 31 0a:58:66:66:00:01 ethertype IPv6 (0x86dd), length 92: (flowlabel 0x08ab0, hlim 251, next-header TCP (6), payload length 32) fc00:f853:ccd:e793::4.31047 > 2013:100:200::6.45192: Flags [F.], cksum 0x0bf9 (incorrect -> 0x4871), seq 152, ack 103, win 64, options [nop,nop,TS val 3700670344 ecr 956030840], length 0
13:41:40.563511 dbbbf1da6bd0a_3 P   ifindex 31 0a:58:66:66:00:06 ethertype IPv6 (0x86dd), length 92: (flowlabel 0x428b7, hlim 255, next-header TCP (6), payload length 32) 2013:100:200::6.45192 > fc00:f853:ccd:e793::4.31047: Flags [.], cksum 0x0bf9 (incorrect -> 0x4872), ack 153, win 63, options [nop,nop,TS val 956030840 ecr 3700670344], length 0
13:41:40.563518 ovn-k8s-mp5 In  ifindex 25 0a:58:66:66:00:01 ethertype IPv6 (0x86dd), length 92: (flowlabel 0x428b7, hlim 254, next-header TCP (6), payload length 32) fd69::14.42588 > fc00:f853:ccd:e793::4.31047: Flags [.], cksum 0xe65d (incorrect -> 0x7839), ack 153, win 63, options [nop,nop,TS val 956030840 ecr 3700670344], length 0

==== v4
13:41:47.103773 dbbbf1da6bd0a_3 P   ifindex 31 0a:58:66:66:00:06 ethertype IPv4 (0x0800), length 80: (tos 0x0, ttl 64, id 61085, offset 0, flags [DF], proto TCP (6), length 60)
    102.102.0.6.36363 > 172.18.0.4.31047: Flags [S], cksum 0x12b1 (incorrect -> 0xd27d), seq 3499923279, win 65280, options [mss 1360,sackOK,TS val 3883601317 ecr 0,nop,wscale 10], length 0
13:41:47.104913 ovn-k8s-mp5 In  ifindex 25 0a:58:66:66:00:01 ethertype IPv4 (0x0800), length 80: (tos 0x0, ttl 63, id 61085, offset 0, flags [DF], proto TCP (6), length 60)
    169.254.0.20.46700 > 172.18.0.4.31047: Flags [S], cksum 0x6676 (correct), seq 3499923279, win 65280, options [mss 1360,sackOK,TS val 3883601317 ecr 0,nop,wscale 10], length 0

 cookie=0xdeff105, duration=10790.247s, table=2, n_packets=13, n_bytes=1336, priority=250,pkt_mark=0x1006,ipv6 actions=mod_dl_dst:3e:76:c5:46:8f:79,output:8
 cookie=0xdeff105, duration=10790.796s, table=2, n_packets=3, n_bytes=222, priority=200,ip,nw_src=169.254.0.20 actions=drop

**Comment by tssurya** [comment]
ETP=cluster, layer2, local gateway v4 and v6 (same for layer3)

(Promiscuous mode not supported on the "any" device)
dropped privs to tcpdump
tcpdump: listening on any, link-type LINUX_SLL2 (Linux cooked v2), snapshot length 262144 bytes
15:33:46.561035 3fbc1cf84559f_3 P   ifindex 16 0a:58:67:67:01:03 ethertype IPv4 (0x0800), length 80: (tos 0x0, ttl 64, id 8923, offset 0, flags [DF], proto TCP (6), length 60)
    103.103.1.3.37470 > 172.18.0.2.32666: Flags [S], cksum 0x14ad (incorrect -> 0x0804), seq 1062464919, win 65280, options [mss 1360,sackOK,TS val 4150326936 ecr 0,nop,wscale 10], length 0
15:33:46.561692 ovn-k8s-mp2 In  ifindex 11 0a:58:67:67:01:01 ethertype IPv4 (0x0800), length 80: (tos 0x0, ttl 63, id 8923, offset 0, flags [DF], proto TCP (6), length 60)
    169.254.0.14.32815 > 172.18.0.2.32666: Flags [S], cksum 0xd890 (correct), seq 1062464919, win 65280, options [mss 1360,sackOK,TS val 4150326936 ecr 0,nop,wscale 10], length 0
15:33:46.561897 ovn-k8s-mp2 Out ifindex 11 0a:58:67:67:01:02 ethertype IPv4 (0x0800), length 80: (tos 0x0, ttl 62, id 8923, offset 0, flags [DF], proto TCP (6), length 60)
    103.103.1.2.32815 > 169.254.0.3.32666: Flags [S], cksum 0x1c47 (correct), seq 1062464919, win 65280, options [mss 1360,sackOK,TS val 4150326936 ecr 0,nop,wscale 10], length 0

--
sh-5.3# tcpdump -i any -nneev tcp port 32666
tcpdump: WARNING: any: That device doesn't support promiscuous mode
(Promiscuous mode not supported on the "any" device)
dropped privs to tcpdump
tcpdump: listening on any, link-type LINUX_SLL2 (Linux cooked v2), snapshot length 262144 bytes
14:19:02.052258 3fbc1cf84559f_3 P   ifindex 16 0a:58:67:67:01:03 ethertype IPv6 (0x86dd), length 100: (flowlabel 0x04c13, hlim 64, next-header TCP (6), payload length 40) 2014:100:200:1::3.51600 > fc00:f853:ccd:e793::2.32666: Flags [S], cksum 0x0bfe (incorrect -> 0x5c04), seq 975105022, win 64320, options [mss 1340,sackOK,TS val 993737437 ecr 0,nop,wscale 10], length 0
14:19:02.053022 ovn-k8s-mp2 In  ifindex 11 0a:58:67:67:01:01 ethertype IPv6 (0x86dd), length 100: (flowlabel 0x04c13, hlim 63, next-header TCP (6), payload length 40) fd69::e.54308 > fc00:f853:ccd:e793::2.32666: Flags [S], cksum 0x7710 (correct), seq 975105022, win 64320, options [mss 1340,sackOK,TS val 993737437 ecr 0,nop,wscale 10], length 0
14:19:02.053080 ovn-k8s-mp2 Out ifindex 11 0a:58:67:67:01:02 ethertype IPv6 (0x86dd), length 100: (flowlabel 0x04c13, hlim 62, next-header TCP (6), payload length 40) 2014:100:200:1::2.54308 > fd69::3.32666: Flags [S], cksum 0x3cbc (correct), seq 975105022, win 64320, options [mss 1340,sackOK,TS val 993737437 ecr 0,nop,wscale 10], length 0
14:19:02.053578 ovn-k8s-mp2 In  ifindex 11 0a:58:67:67:01:01 ethertype IPv6 (0x86dd), length 100: (flowlabel 0x04c13, hlim 61, next-header TCP (6), payload length 40) 2014:100:200:1::2.54308 > fd69::3.32666: Flags [S], cksum 0x3cbc (correct), seq 975105022, win 64320, options [mss 1340,sackOK,TS val 993737437 ecr 0,nop,wscale 10], length 0
14:19:02.053610 ovn-k8s-mp2 Out ifindex 11 0a:58:67:67:01:02 ethertype IPv6 (0x86dd), length 100: (flowlabel 0x04c13, hlim 60, next-header TCP (6), payload length 40) 2014:100:200:1::2.18193 > fd69::3.32666: Flags [S], cksum 0xc9cf (correct), seq 975105022, win 64320, options [mss 1340,sackOK,TS val 993737437 ecr 0,nop,wscale 10], length 0
14:19:02.054055 ovn-k8s-mp2 In  ifindex 11 0a:58:67:67:01:01 et

**Comment by danwinship** [comment]
update to this: #6610 (specifically migrating NodePort rules from iptables to nftables) changes the exact details a bit (because of the differences Surya pointed out above between iptables and nftables "addrtype local" handling with VRFs), but it doesn't change which tests pass and which tests fail.
